year,month,day,title
2015,12,31,"Social media, upgraded theaters help drive $11 billion year View"
2015,12,30,"Community calendar: festivals, fairs and more"
2015,12,30,Notable passings in 2015
2015,12,29,Blockbusters propel 2015 domestic box office to record $11B
2015,12,28,'Force Awakens' soars with $1B on record weekend at theaters
2015,12,28,'Star Wars' makers have high hopes for China success View
2015,12,27,'Force Awakens' becomes fastest movie to reach $1 billion
2015,12,27,10 Things to Know for Monday
2015,12,27,'Force Awakens' becomes fastest movie to $1 billion
2015,12,26,"UW's Chris Petersen, Myles Gaskin, Jaydon Mickens react to the Huskies' victory over Southern Miss"
2015,12,24,Sun Bowl visit to children's hospital leaves impression on WSU Cougars football players
2015,12,24,2 singalongs and holiday favorites galore
2015,12,24,Hyatt and SunEdison are big market movers
2015,12,24,Take the family to the movies: 9 options for what to go see
2015,12,24,‘The Book of Mormon’ back in Seattle for third time
2015,12,23,"Community calendar: festivals, fairs and more"
2015,12,23,'Star Wars' trailers vs. what ended up in the film
2015,12,23,'Star Wars' named Associated Press Entertainer of the Year
2015,12,22,Critics' Choice add 'Force Awakens' as best picture nominee
2015,12,22,"Man jailed after student threatened over ""Star Wars"" spoiler"
2015,12,21,Musk’s SpaceX returns rocket for perfect upright landing
2015,12,21,Box Office Top 20: 'Star Wars' bests 'Jurassic World' record View
2015,12,21,'Star Wars' fan in NY legally changes name to Darth Vader
2015,12,21,"Travel 2016: Rio, Indy 500, German beer, Christo in Italy View"
2015,12,20,10 Things to Know for Monday
2015,12,20,Huskies ramp up the intensity in buildup to Heart of Dallas Bowl
2015,12,20,"UW's Chris Petersen on final preparations for the Heart of Dallas Bowl, Jimmy Lake's promotion, new D-line coach and more"
2015,12,20,'Star Wars' blasts opening weekend record with $238 million
2015,12,20,"The Week Ahead: Garden d’Lights, Poncho Sanchez, and ‘Wonderful Life’"
2015,12,20,The fashion Force is strong
2015,12,20,"A look back at 2015’s best/worst movies, in verse"
2015,12,20,German church celebrates 'Star Wars' at a Sunday service
2015,12,20,Debate Takeaways: Candidates move on from data dust-up
2015,12,19,Debate Takeaways: Candidates move on from data dust-up
2015,12,19,The Latest: Updates from the Democratic presidential debate
2015,12,19,Christie says 'show time' is over in New Hampshire
2015,12,19,'Force Awakens' crosses $250M globally after record Friday
2015,12,18,'Force Awakens' on track for record $215M-plus weekend
2015,12,18,"Key Apple updates to note, then it’s time to play games!"
2015,12,18,"Marquese Chriss and David Crisp on UW's fast start, Oakland and Star Wars"
2015,12,18,A Christmas wish list without regrets
2015,12,18,Star Wars mania comes to the White House
2015,12,18,'Force Awakens' on track for record $215M-plus weekend
2015,12,18,TV Picks for Friday include ‘The Soup’ and Sinatra celebration
2015,12,18,10 Things to Know for Today
2015,12,18,"'Star Wars: The Force Awakens' thrills fans, sets records"
2015,12,17,Jets developing virtual experience to bring fans even closer
2015,12,17,New Orleans-style mirth marks arrival of 'The Force Awakens' View
2015,12,17,The Latest: Parade caps New Orleans Star Wars celebration
2015,12,17,'Star Wars' is the Force that guides our culture
2015,12,17,'Star Wars' fans pack Seattle Cinerama View
2015,12,17,"Movie bargains: ‘Goosebumps,’ ‘He Named Me Malala’"
2015,12,17,Higher force: Church using power of 'Star Wars' at Christmas
2015,12,17,"‘Star Wars’ frenzy has started, Seattle-style"
2015,12,17,Philadelphia police talk tough about Star Wars spoilers
2015,12,17,"A year in pop culture: Hellos, goodbyes, and Caitlyn Jenner View"
2015,12,17,Here's what messed up your Seattle-area commute Thursday morning
2015,12,17,"'Force Awakens' satisfies fans, earns $14.1 million overseas"
2015,12,17,"Funny robots, crazy hair: Pop culture appeal of 'Star Wars'"
2015,12,17,New Orleans-style mirth marks arrival of 'The Force Awakens'
2015,12,17,Egypt theater cancels Star Wars showings on opening day
2015,12,17,10 Things to Know for Friday
2015,12,17,‘Sisters’ act with Amy Poehler and Tina Fey
2015,12,16,"AP's top 10 movies of the year led by 'Carol,' 'Mad Max'"
2015,12,16,"Community calendar: festivals, fairs and more"
2015,12,16,"AP's top 10 movies of the year led by 'Carol,' 'Mad Max'"
2015,12,16,CVS and SolarCity are big market movers
2015,12,16,'Star Wars: The Force Awakens' makes AFI's top movie list
2015,12,16,Hit the alarm: 'Star Wars' wakes again View
2015,12,16,10 Things to Know for Thursday
2015,12,16,Review of ‘Star Wars: The Force Awakens’: This new alliance is strong
2015,12,15,"""Star Wars"" fan's dream job: Crafting realistic lightsabers View"
2015,12,15,"As 'Star Wars' returns, a new generation quakes"
2015,12,15,Seattle screen one of 7 best to see the new 'Star Wars'
2015,12,15,A Jedi mine trick for Bertha?
2015,12,14,"Cheers for familiar, new 'Star Wars' characters at Hollywood premiere View"
2015,12,14,British astronaut hopes to see new Star Wars movie in space View
2015,12,14,"Hollywood ready for world premiere of ""The Force Awakens"" View"
2015,12,13,"Lawrence Kasdan on the past, present and future of Han Solo"
2015,12,12,Thousands in costumes revel at festive SantaCon View
2015,12,12,Can ‘Star Wars’ unify a disintegrating American culture?
2015,12,11,Some tech toys to inspire a child’s imagination
2015,12,11,'Star Wars' superfan? Share pictures of your favorite collectibles
2015,12,11,The original 1977 reviews of 'Star Wars'
2015,12,11,The Force is with remote Irish island — a ‘Star Wars’ shooting location
2015,12,10,"From food to makeup, ‘Star Wars’ stuff is out of this world View"
2015,12,10,Buildings with fresher air linked to better thinking
2015,12,9,"Community calendar: festivals, fairs and more"
2015,12,9,"Adele's '25,' 'Uptown Funk' top iTunes end of year lists"
2015,12,9,Facebook hails US presidential race as 2015's top topic
2015,12,8,Netflix joins the holiday TV club with ‘A Very Murray Christmas’
2015,12,6,"These teen students can code a video game — and so should yours, technologists say"
2015,12,6,May the gingerbread be with you at ‘Star Wars’ village View
2015,12,6,Kid + computer science = a better future
2015,12,6,'Star Wars' timeline: stories from a long time ago
2015,12,6,Why do we like ‘Star Wars’ so much? A critic’s take
2015,12,4,‘Star Wars’ apps keep the force with you till the movie arrives
2015,12,4,Seattle Times’ critics best books of 2015
2015,12,2,"Community calendar: festivals, fairs and more"
2015,12,1,How to make a tin man? Ask the wizards of 'The Wiz Live!'
2015,11,30,Pink joins UNICEF in fight to end child malnutrition
2015,11,30,Seattle filmmaker Freddie Wong’s work makes jump to Hulu
2015,11,30,"Cyber Monday sales still on top, but losing some luster"
2015,11,29,Your guide to the big holiday blockbuster movies of 2015
2015,11,27,Super Bowl of shopping is more like a scrimmage
2015,11,27,Mr. Wrap’s cliché-ridden bowl-watching guide: It’s all about the ‘want to’
2015,11,27,Toys ‘R’ Us CEO sees signs of slower sales growth for toys
2015,11,27,Documents: White House fence jumper left suicide note View
2015,11,27,Super Bowl of shopping is more like a scrimmage View
2015,11,25,Campbell rethinks its soup recipe as consumer tastes change
2015,11,25,Cinemas add ‘Yoda-ritas' to boost ‘Star Wars' revenue
2015,11,25,WSU linebacker Peyton Pelluer latest in family’s long line of Cougars
2015,11,24,"Obama honoring Streisand, Spielberg, Yogi Berra and more"
2015,11,23,1D wins big at AMAs; Dion pays tribute to Paris victims View
2015,11,20,"Holiday festivals, 2015"
2015,11,18,"Community calendar: festivals, fairs and more"
2015,11,18,It’s beginning to look like Christmas thanks to these Seattle events
2015,11,17,Ex-Obama official writing 'Star Wars' book
2015,11,16,Microsoft teams with Code.org on 'Minecraft' tutorial for kids
2015,11,11,"Community calendar: festivals, fairs and more"
2015,11,11,How Veterans Day is commemorated around the United States View
2015,11,10,"Toy sales make comeback thanks to movie tie-ins, tech"
2015,11,9,"'Spectre' shoots to $73 million, misses 'Skyfall's' mark"
2015,11,9,Code.org brings the force of ‘Star Wars’ to its mission
2015,10,28,Haute dogs fill social calendars — and closets — for Halloween
2015,10,26,"'Jem,' 'Kasbah,' 'Witch Hunter' tank, 'Steve Jobs' fizzles"
2015,10,23,Hundreds at candlelight vigil for Swedish school stabbings View
2015,10,22,The watchers: Obsessive bunch penetrates North Korea's totalitarian fog
2015,10,21,Faraway object being destroyed by real-life 'Death Star'
2015,10,20,‘Star Wars’ ticket sales set records two months before opening
2015,10,20,New 'Star Wars' trailer debuts; fans crash ticket sellers’ websites
2015,10,20,"Stars celebrate women in entertainment, call for equality"
2015,10,18,Tickets to go on sale Monday for new 'Star Wars' film
2015,10,14,Family of boy blessed by pope gets nearly $100k in support
2015,10,14,"‘Waterfall’ musical at 5th Avenue blends Thai, Broadway talents"
2015,10,13,The Latest: Trump offers his assessment of the Democrats
2015,10,7,"Community calendar: festivals, fairs and more"
2015,10,2,S’Klallam artist helps revive Native comic book hero Red Wolf
2015,9,30,"Community calendar: festivals, fairs and more"
2015,9,27,‘Make Me’ tops fiction best-sellers list
2015,9,21,The pope as a global diplomat
2015,9,20,Sue Grafton stays on top of best-sellers list with ‘X’
2015,9,16,"Community calendar: festivals, fairs and more"
2015,9,15,"3 getaways for this weekend, from Rainier mountain fest to Portland Comic Con"
2015,9,15,'Star pupil': Pied piper of ISIS recruits was trained by U.S.
2015,9,12,Boeing unveils Star Wars R2-D2 plane Watch
2015,9,12,Husky Stadium naming-rights deal a disservice to fans
2015,9,12,Video: Boeing unveils Star Wars R2-D2 plane
2015,9,9,"Community calendar: festivals, fairs and more"
2015,9,8,Disney teams up with Amazon and Microsoft
2015,9,3,Disney unveils Star Wars toys amid marketing blitz View
2015,9,3,‘Star Wars’ fans lining up for $150 BB-8 droid
2015,9,2,"Community calendar: festivals, fairs and more"
2015,9,1,Fall Movie Preview: Abrams on keeping 'Star Wars' grounded View
2015,8,31,"At Disney theme parks, a big shift away from Mickey"
2015,8,27,Christmas in August: Wal-Mart's holiday layaway comes early
2015,8,25,Bush hit from both sides on birthright citizenship
2015,8,21,The week’s passages View
2015,8,18,"Vern Fonk pitchman, exec Robert Thielke, 50, dies"
2015,8,17,‘Star Wars’ to take off at Disneyland
2015,8,16,Disney taps startup for BB-8 droid toy
2015,8,15,'Star Wars'-themed attractions planned at Disney parks
2015,8,14,Johnny Depp makes surprise appearance at Disney convention
2015,8,11,What Stephen Colbert says about Trump as opening night nears
2015,8,6,Feds cite carburetor problem in Harrison Ford plane crash
2015,8,6,"Marymoor Park hosts two iconoclasts — Alabama Shakes, Wilco"
2015,8,5,Comcast on billion-dollar ride to expand Universal theme parks
2015,8,4,Geek culture has gone too far
2015,8,4,"Your week in Seattle music: Taylor Swift, D'Angelo and more"
2015,7,23,Oklahoma police scour social media for clues to stabbings View
2015,7,21,FACT CHECK: Trump shortchanges McCain's record on veterans
2015,7,17,'Ludicrous Mode'? Tesla adds power to already-fast Model S
2015,7,12,May the dress be with you ... at EMP’s ‘Star Wars’ costume show
2015,7,10,"Ford, Abrams shed light on 'Star Wars: The Force Awakens' at Comic-Con View"
2015,7,5,Cinema Books to close its doors on Roosevelt after 31 years
2015,7,2,"Our flag, used as a symbol of pride and protest, tells a lot about who we are View"
2015,6,28,Don’t fret too much about focus on the kids
2015,6,27,"Inslee: Tentative budget deal eases tuition burden, raises teachers’ pay"
2015,6,26,SpaceX capsule to deliver new parking spot for space station
2015,6,24,Rant & Rave: Loved the Star Wars fireworks
2015,6,21,"The Week Ahead: Kenny Chesney, Willie Nelson and International Festival of Improv"
2015,6,18,"‘Jaws,’ ‘Pride,’ Shakespeare and return of ‘Midnight’ series"
2015,6,17,"Community calendar: festivals, fairs and more"
2015,6,17,‘Poldark’: Brooding hunks on English moors never go out of style
2015,6,15,EA hypes ‘Star Wars’ games
2015,6,15,3 new dog breeds join American Kennel Club pack
2015,6,11,"Actor Christopher Lee dies; played villains in 'Lord of the Rings,' 'Star Wars' films"
2015,6,6,"Letting Ex-Im Bank die would kill jobs, not crony capitalism"
2015,6,3,"Community calendar: festivals, fairs and more"
2015,5,24,Star Times: Spring sports all-stars
2015,5,22,"Community calendar: festivals, fairs and more"
2015,5,19,What’s new in theme parks for summer
2015,5,13,"Community calendar: festivals, fairs and more"
2015,5,7,Coach Gaylord Perry might approve of this stunt
2015,5,6,"Community calendar: festivals, fairs and more"
2015,5,4,Plenty say “May the 4th Be With You” View
2015,5,3,No sure ride for Disney prince to Magic Kingdom throne
2015,5,3,"Mariners minor league report, May 3"
2015,5,3,"The Week Ahead: Beer, boats and Ballard jazz lead the way for fun"
2015,4,29,"Community calendar: festivals, fairs and more"
2015,4,24,"Community calendar: festivals, fairs and more"
2015,4,22,The Motley Fool
2015,4,22,5 things to do with your newspaper on Earth Day
2015,4,19,Director reveals plot for ‘Star Wars’ film ‘Rogue One’
2015,4,15,"Community calendar: festivals, fairs and more"
2015,4,8,"Community calendar: festivals, fairs and more"
2015,4,5,The List: 4 favorite movie sequels
2015,4,4,Rahm Emanuel gains steam in tough Chicago mayoral runoff
2015,4,2,Not easy being green in comic-book musical ‘Lizard Boy’
2015,4,1,"Community calendar: festivals, fairs and more"
2015,3,29,London Symphony to close festive tour with Seattle stop
2015,3,27,EMP Museum creates ‘Infinite Worlds of Science Fiction’
2015,3,19,U.S. classics at Cinerama; Thai treats; French noir
2015,3,17,"Rivals, environmentalists steaming over Keurig’s coffee pods"
2015,3,12,"‘Frozen 2’ is on the way, Disney tells shareholders"
2015,3,11,"Community calendar: festivals, fairs and more"
2015,3,10,More Star Wars attractions for Disneyland?
2015,3,4,"Community calendar: festivals, fairs and more"
2015,3,3,Doughnut wars: Seattle sweets vs. Portland pastries
2015,3,1,"The Week Ahead: Dino Day at the Burke, hockey in the Cold War"
2015,2,25,"Community calendar: festivals, fairs and more"
2015,2,18,"Community calendar: festivals, fairs and more"
2015,2,18,"Community calendar: festivals, fairs and more"
2015,2,18,"Community calendar: festivals, fairs and more"
2015,2,15,Gut-wrenching losses leave an eternal sting
2015,2,12,"Community calendar: festivals, fairs and more"
2015,2,9,No Israeli politician spared from bite of TV satire
2015,2,7,"Talib Kweli, Draze kick off Black History Month at EMP"
2015,2,6,"For video-game designer Kathie Flood, no thongs, no gore"
2015,2,4,"Community calendar: festivals, fairs and more"
2015,1,31,"The game, Star Wars costumes, volcanoes | Community Corner"
2015,1,31,"Hey, Eastern Washington: Don’t give us any (divorce) ideas"
2015,1,29,‘Star Wars’ exhibition lands at EMP Museum
2015,1,29,"Beatles program, Billy Dee Williams appearance, cat fest"
2015,1,11,Karen Lord’s ‘The Galaxy Game’: power tripping
2015,1,9,Actor Rod Taylor dies in Los Angeles at 84
2015,1,1,Pop culture helps change minds on gay rights
2014,12,31,From Angelou to Zimmer: 101 notable deaths in 2014
2014,12,27,Will 'The Interview' change how Hollywood does business?
2014,12,26,New and returning midseason cable TV shows
2014,12,23,"‘Boyhood’ good, ‘Non-Stop’ a flop: A 2014 movie poem"
2014,12,22,2014 Seattle Times Reader Photos of the Year
2014,12,3,Lorde vs. Katniss: ‘Hunger Games: Mockingjay’ soundtrack
2014,12,3,Lorde vs. Katniss: ‘Hunger Games: Mockingjay’ soundtrack
2014,12,3,Meet the four-legged actors in the 5th Ave’s ‘A Christmas Story’
2014,12,3,Meet the four-legged actors in the 5th Ave’s ‘A Christmas Story’
2014,12,1,New 'Star Wars' teaser: No Cumberbatch
2014,11,30,Fans go wild over 88-second 'Star Wars' teaser
2014,11,30,"For the pet that has everything: GoPro harness, legwarmers"
2014,11,29,Fans go wild over 88-second 'Star Wars' teaser
2014,11,29,"Wed in a lion’s cage: At 103, she’s still queen of the Paris circus"
2014,11,28,"Longevity, icon status get toys into hall of fame"
2014,11,26,Milky Way over The Mountain
2014,11,20,Give your pet something unexpected over holidays
2014,11,17,Calif. theme-park wars: Knott’s Berry Farm going high-tech
2014,11,16,"As Disney studio chief, Horn plays ‘janitor’ and statesman"
2014,11,6,New ‘Star Wars’ film has a name: ‘The Force Awakens’
2014,10,29,A ‘Frozen’ Halloween is in the forecast
2014,10,28,House Republicans make liberal use of Obama in ads
2014,10,26,Eastside Catholic knocks off talented Utah team
2014,10,24,Darth Vader hopes force with him in Ukraine polls
2014,10,22,Toys ‘R’ Us stands ground on ‘Breaking Bad’ action figures
2014,10,22,"Will ‘Ouija,’ the film, make sales of ‘spirit board’ jump?"
2014,10,10,‘Movie Music of John Williams’ at Seattle Symphony pops
2014,10,8,"Community calendar: festivals, fairs and more"
2014,10,5,"‘Gone Girl’ Seattle Pops, Kay Ryan and M.C. Escher on tap this week"
2014,10,4,"The Motley Fool: Every Sunday, useful tips on investing"
2014,9,27,Born famous: How Seattle's geekiest YouTuber wants to bring up baby 'Jedi'
2014,9,26,"Military is big business in state, but at what cost?"
2014,9,25,"‘The BoxTrolls’: Out comes humor, surprises, great visuals"
2014,9,23,Sept. 23 TV Picks: ‘NCIS: New Orleans’ series premiere
2014,9,22,'The Lion King' earns record box office
2014,9,14,Space goals can lift down-to-earth ones
2014,9,11,How Dennis Lehane’s ‘Drop’ screenplay became a novel
2014,9,5,"Monsoon floods kill 116 in Kashmir, east Pakistan"
2014,8,28,‘Kundo: Age of the Rampant’: Chilly villain makes epic sizzle
2014,8,25,Remember Netscape browser? Class of '18 doesn't
2014,8,16,Postal Service criticized for favoring pop culture on stamps
2014,8,10,Papa Murphy’s leader doing more than raising dough
2014,8,7,Body of U.S. general arrives at Dover Air Force Base
2014,8,7,Thursday Memo: High-priced houses ... Super Bowl rematch - sorta ... M's in playoff hunt?
2014,8,6,New Afghan attack kills 7 after US general slain
2014,8,5,General killed in Afghan attack was engineer in first war post
2014,7,30,‘Guardians’ explodes into big summertime fun
2014,7,29,‘Guardians of the Galaxy’ director on his quirky vision
2014,7,28,"The knockdown, drag-out battle over coconut water"
2014,7,11,"There are fewer lanes now, but we’re still bowling View"
2014,7,7,Ford injury to halt 'Star Wars' for 2 weeks
2014,7,3,Chechen in Syria a rising star in extremist group
2014,7,1,Venerable printer of LP jackets reaps rewards of vinyl’s rebirth
2014,7,1,Hamas member killed after Israeli teens found dead
2014,6,25,Chicago mayor: George Lucas museum boon for city
2014,6,24,Woman or machine? New robots look creepily human
2014,6,24,‘Star Wars’ museum to be built in Chicago
2014,6,20,"Director news, from 'Star Wars' to Shakespeare"
2014,6,14,Guest: The pain of the World Cup for a former Iranian player
2014,6,13,Obama makes first visit to Indian reservation as president
2014,6,12,Harrison Ford injures ankle on set of 'Star Wars'
2014,6,9,"To save trauma victims, doctors may swap blood with cold water till patients die"
2014,6,8,Sunday Best: breezy summer style on Lupita Nyong’o
2014,6,6,Emotional robot set for sale in Japan next year
2014,6,1,"Summer Jam, Beacon Hill fest top list of 18 A&E highlights"
2014,5,30,San Francisco offers George Lucas a museum site
2014,5,28,A Hogwarts update
2014,5,28,"From beaches to Bangkok, tourists ask 'What coup?'"
2014,5,27,Coup? What coup? Some tourists party on in Thailand
2014,5,22,"‘Navajo Weekend,’ ‘Easy Rider,’ ‘Dryland’ rev up the week"
2014,5,22,Fix to veterans' health care takes on new resolve
2014,5,16,"'Decisive action' now, Patty Murray tells VA head"
2014,5,16,Congress growing impatient on inquiry in VA deaths
2014,5,15,APNewsBreak: Obama aide to oversee VA review
2014,5,4,"May the Fourth be with you, Star Wars Day View"
2014,5,3,"Free comic books, plant sale, bee festival | Community Corner"
2014,5,2,Old NASA spacecraft generates new buzz and plans
2014,5,1,‘Giant Monsters’ take over the Uptown; film festivals; ‘Othello’
2014,5,1,Few dozen marchers remain on Capitol Hill
2014,5,1,"Museums, comic books, boats and flowers | Weekend Preview"
2014,4,30,"Community calendar: festivals, fairs and more"
2014,4,30,Turning to Star Wars to revive Tunisia tourism
2014,4,30,Wednesday Memo: Warm-weather warning ... Tunnel diggers? ... Stolen screenplay?
2014,4,29,'Star Wars: Episode VII' cast unveiled
2014,4,29,'Star Wars: Episode VII' cast announced
2014,4,16,BBC America’s ‘Real History’ is Science Fiction 101
2014,4,11,Man arrested in deadly Florida day care crash
2014,4,10,NCAA is the Soviet Union? Where’s the Smirnoff Bowl?
2014,4,9,Queen hosts Irish president on 1st UK state visit
2014,4,4,"Exploring spices, we bring the world to our tables View"
2014,4,1,California's $425M Powerball winner comes forward
2014,3,31,Alt comics artists take us to Seattle's rough edges View
2014,3,28,Philadelphia releases star receiver DeSean Jackson
2014,3,25,Please don’t let C-3PO find out about latest fashion
2014,3,19,New 'Star Wars' set 30 years after 'Jedi'
2014,3,18,It's baaack . . . 'Star Wars: Episode VII' filming soon
2014,3,16,Noah’s arc of triumph
2014,3,14,Minister: Israeli tourists to Tunisia lacked visas
2014,3,5,Lewis-McChord Stryker troops train for different kind of combat
2014,2,23,"Feb. 23 TV Picks: Olympics closing, but ‘Dead’ walking"
2014,2,19,Feb. 19 TV Picks: ‘Men at Work’ on TBS
2014,2,19,US Navy ready to deploy laser for 1st time
2014,2,17,"Elvis, ‘Star Trek’ pet projects inspire marketing duo"
2014,2,17,"Navy ready to deploy laser, hypersonic weapons"
2014,2,8,"Neighborhoods, robots and bikes | Community Corner"
2014,2,6,"G.I. Joe, the world’s first action figure, turns 50"
2014,2,4,Recap: live coverage of the Super Bowl parade
2014,2,1,Winning is when things start to get complicated
2014,1,29,An unpaid bill leads to costly video game battle
2014,1,28,"‘EVE Online’ video game swept up in huge, pricey virtual battle"
2014,1,18,Sharing the language of music on China tour
2014,1,16,List of 86th annual Academy Award nominations
2014,1,2,"Nations jockey for Arctic position, US not in lead"
2013,12,29,Week Ahead: New Year’s celebrations in full bloom
2013,12,27,Hollywood struggles against new film meccas
2013,12,26,Seattle Symphony’s year-end plans: traditional and the new
2013,12,17,"Maybe not sci-fi, but robots readied for big tests"
2013,12,14,Robinson Cano’s journey to stardom was years in the making
2013,11,28,"Budda Baker, Chico McClatcher: Sizing up 2 big-time recruits"
2013,11,17,Bellevue gun-rights advocate becomes key player in national debate
2013,11,10,Swedish cinemas launch feminist movie rating
2013,11,7,Which Seattle restaurant has America's best bathroom?
2013,11,6,"‘We’re not pirates,’ anti-whaling sailor Paul Watson tells Seattle court"
2013,11,6,Swedish cinemas launch feminist movie rating
2013,11,2,The week’s passages
2013,10,25,Music festival launches in Vegas this weekend
2013,10,24,'Star Wars: Episode VII': Abrams and Kasdan take over scriptwriting
2013,10,19,"Star Wars Reads Day, birds and trucks | Community Corner"
2013,10,16,Medal of Honor recipient gets apology; Army makes changes
2013,10,16,US officials: Medal of Honor recipient asks Army to bring him back to active duty
2013,10,15,"‘The Heat,’ ‘Pacific Rim,’ ‘Kevin Hart: Let Me Explain’"
2013,10,13,Sundaresan’s ‘The Mountain of Light’: a star-crossed gem
2013,10,12,"On top of failed inspections, US nuclear force now hit with alleged top-level misbehavior"
2013,10,4,APNewsBreak: 'Hobbit' trilogy costs $561M so far
2013,9,29,NASA preparing to launch 3-D printer into space
2013,9,29,Big day for commercial space industry: Key launch and docking
2013,9,23,"Bryan Cranston, Cher offer custom phone recordings"
2013,9,21,"The Motley Fool: Every Sunday, useful tips on investing"
2013,9,16,"After long wait, Seattle man to receive Medal of Honor"
2013,9,15,"‘How the Light Gets In,’ ‘Zealot’ local top-sellers"
2013,9,12,NASA: Voyager 1 probe has left the solar system
2013,9,11,'Star Wars' actor Mayhew has surgery on knees
2013,9,10,"Taylor Swift, Kacey Musgraves lead CMA nominees"
2013,9,7,Culling of British badgers pits farmers against animal activists
2013,9,5,"5 myths about Sweden, as Obama visits"
2013,9,4,Dark Horse Comics brings 'The Star Wars' to life
2013,9,2,Carmakers try to put showroom in an app
2013,9,1,‘The Cuckoo’s Calling’ and ‘Zealot’ are local best-sellers
2013,8,30,Bumbershoot daily highlights
2013,8,27,Look out: A fall harvest of new broadcast TV shows
2013,8,27,'Star Wars' cinematographer Gilbert Taylor dies
2013,8,26,5 comedy shows to see at Bumbershoot 2013
2013,8,23,Ballmer leaving a mixed legacy
2013,8,22,Veterans Affairs chief aims to clear VA claims backlog by 2015
2013,8,11,‘The Ocean at the End of the Lane’ is a Northwest best-seller
2013,7,28,Sunday TV Picks: ‘Unforgettable’ on CBS
2013,7,22,"S&P 500 edges higher, helped by gold miners"
2013,7,16,Tuesday TV Picks: a new season of ‘Suits’ on USA
2013,7,15,"Petraeus, criticized over salary, will take $1 instead"
2013,7,9,A love letter to 'Jaws'
