year,month,day,title
2013,7,9,AP IMPACT: MIA efforts risk 'total failure'
2013,7,5,Friday TV Picks: ‘Continuum’ on Syfy
2013,7,4,"With cuteness on steroids, ‘Despicable’ minions are stars"
2013,6,26,"Community calendar: festivals, fairs and more"
2013,6,26,Would you pay $50 to see a flick? Some fans did
2013,6,24,Churches conflicted over Scouts’ policy change on gays
2013,6,20,James Gandolfini leaves behind 2 completed films
2013,6,18,Military women moving into jobs closer to combat
2013,6,10,TSA takes close look at ‘Star Wars’ actor’s light saber
2013,6,9,Idaho family on mission to find pilot lost in Korean War
2013,6,9,13 good SIFF movies returning to Seattle
2013,6,5,Return of Ichiro stirs memories
2013,6,4,The top iPhone and iPad apps on App Store
2013,6,3,Congressmen find few Boston attack clues in Russia
2013,5,25,Last inspection: The precise ritual of dressing the nation’s war dead
2013,5,23,"SIFF 2013, week 2: 11 movies to see"
2013,5,15,Zoe Saldana brushes off criticism of Nina Simone role
2013,5,13,JJ Abrams boldly going from 'Trek' to 'Star Wars'
2013,5,7,Pakistan voters show new faith in democracy
2013,5,7,"New stock market milestone: Dow 15,000"
2013,5,7,Special effects master Ray Harryhausen dies at 92
2013,5,4,Larry Stone's MLB power rankings
2013,5,1,"Community calendar: festivals, fairs and more"
2013,4,30,MLS power rankings by Joshua Mayers
2013,4,30,Abandoned light saber closes downtown bus tunnel
2013,4,29,Germ-zapping 'robots': Hospitals combat superbugs
2013,4,28,Suspicious homemade light saber closes Seattle Transit Tunnel
2013,4,18,‘Oblivion’: Scene it? Sci-fi flick copycats other films
2013,4,16,"‘Django Unchained,’ ‘Summer Wars’ | New DVDs"
2013,4,15,"'42' scores at home, Cruise dominates overseas"
2013,4,14,"Gifted tinkerer helped Boeing design spacecraft, missiles"
2013,4,5,Roger Ebert on some classic films and movie duds
2013,4,4,Thumbs up — and down
2013,3,27,Harrison Ford not 'yet' ready to talk 'Star Wars' sequels
2013,3,17,Sunday TV Picks: ‘Red Widow’ on ABC
2013,3,13,Hagel puts brakes on new cyber medal
2013,3,8,Paul energizes supporters with Senate filibuster
2013,3,7,Lucas says 'Star Wars' trio returning for new film
2013,3,7,Alan Rickman to direct Kate Winslet
2013,3,5,They Might Be Giants’ ‘Nanobots’ may yield new hits
2013,3,1,"Beam me up, Yoda: Obama flubs ‘Star Trek’ term"
2013,3,1,"Beam me up, Yoda: Obama flubs `Star Trek' term"
2013,2,24,"Rape of adopted Ohio kids unusual, haunting case"
2013,2,23,The week’s passages
2013,2,21,'Top Chef: Seattle' down to final 2 chefs
2013,2,21,Lego sales soar on demand for new girls' series
2013,2,20,Celebrate spring at the Northwest Flower & Garden Show
2013,2,17,Glimpse of gaming future: Bungie's 'Destiny'
2013,2,13,Military’s newest honor: medal for digital warriors
2013,2,12,"Military weighs cutbacks, shifts in drone programs"
2013,2,6,"Freeborn, makeup artist behind Yoda, dies at 98"
2013,2,6,"In Vegas, Abrams gives few hints about 'Star Wars'"
2013,2,5,Disney working on stand-alone 'Star Wars' films
2013,2,5,The top iPhone and iPad apps on App Store
2013,2,1,Gizmos may just keep 200 buildings standing in tunnel dig
2013,2,1,Fewer snowboarders hit the slopes (and skiing is cool again)
2013,1,28,Time takes toll on Tuskegee Airmen
2013,1,27,Abrams on 'Star Wars': 'surreal' and 'exciting'
2013,1,24,Reports: JJ Abrams to direct next 'Star Wars'
2013,1,24,Report: J.J. Abrams to direct the next 'Star Wars'
2013,1,22,Sex is major reason military commanders are fired
2013,1,21,"In ‘augmented reality,’ toy makers see a way to compete with apps"
2013,1,20,Three things we love this week
2013,1,17,"Newtown mom dreams about son, urges gun law reform"
2013,1,12,Obama won't support building 'Death Star'
2013,1,11,"'Book of Mormon': an outrageous, but good-natured, trip from Utah to Africa | Theater review"
2013,1,9,UN wants to use surveillance drones in Congo
2013,1,9,GOP senator threatens delay on CIA nomination
2013,1,8,Hagel's own words are fodder for critics
2013,1,8,Obama defense pick faces rough going in Senate
2013,1,7,Obama sends military one of its own as DOD chief
2013,1,5,Mormons view 'Book of Mormon' more as opportunity than offense
2012,12,31,Aaron Gordon puts on a show at Oregon holiday tournament
2012,12,30,Sunday’s TV Picks: ‘Call the Midwife Holiday Special’
2012,12,29,"McCartney, 'God particle' scientist get honors"
2012,12,28,"McCartney, 'God particle' scientist get honors"
2012,12,27,Gen. Norman Schwarzkopf dies; led 1991 liberation of Kuwait
2012,12,24,'Odd Couple' star Jack Klugman dies in LA at 90
2012,12,14,Twisted toys from twisted minds
2012,12,14,"From Walla Walla to the nation's capital, sculptures honoring our wounded warriors View"
2012,12,13,AP music writers' top 10 albums of the year
2012,12,11,The top iPhone and iPad apps on App Store
2012,12,4,Netflix outbids Starz for rights to Disney movies
2012,12,3,Spacey unveils star-studded 2013 Old Vic line-up
2012,11,30,"Carrie Underwood as Maria Von Trapp, and other news"
2012,11,27,Guess who's NOT directing the next 'Star Wars'?
2012,11,27,The top iPhone and iPad apps on App Store
2012,11,24,Martha Stewart inspires new wave of tech-savvy entrepreneurs
2012,11,21,"'Star Wars' 7 may bring new hope, but also letdown"
2012,11,19,"Tip Toland’s cheery, startling ceramic ‘jesters’ hold court at Seattle’s Davidson Galleries | Art review"
2012,11,17,Veterans killed in train crash were war heroes
2012,11,16,Things to read for the weekend
2012,11,15,"'Star Wars' figures, dominoes in Toy Hall of Fame"
2012,11,10,"Petraeus' biographer a military reservist, scholar"
2012,11,5,Force is strong with dream `Star Wars' directors
2012,11,4,Lucas plans 'little personal films' in future
2012,11,3,"Saturday Memo: Octopus hunt legal, 520 pontoons fixable, time to turn back clocks"
2012,11,2,Civil Disagreement: Should we have a Star Wars VII?
2012,10,31,Disney unlikely to change 'Star Wars' brand
2012,10,30,Disney to buy Lucasfilm for $4.05 billion; promises new ‘Star Wars’
2012,10,30,"Disney buying Lucasfilm, will continue 'Star Wars' movie series"
2012,10,30,Twitter abuzz with Disney-Lucas mashups
2012,10,30,At a Glance: A list of Lucasfilm movies
2012,10,30,"Disney acquires Lucasfilm, 'Star Wars' franchise"
2012,10,29,Former suspect in Etan Patz case to be freed
2012,10,28,"Big bird, BS and birth control"
2012,10,26,Sununu backs off race statement about Powell
2012,10,23,WHY IT MATTERS: Missile Defense
2012,10,23,"New DVDs | 'Magic Mike,' 'The Invisible War'"
2012,10,21,The week ahead: Arts and entertainment highlights for the week beginning Oct. 21
2012,10,12,Now fan-girls of the sci-fi world have their own geek-chic apparel
2012,10,11,'Atlas Shrugged: Part II': Story holds back faster-paced sequel
2012,10,11,Real-life meth trade is cracked by 'Breaking Bad'
2012,10,7,SpaceX Dragon capsule launched to space station
2012,10,6,"Gold Star mother mourns 2,000th casualty in Afghan war"
2012,10,6,"Community Corner: Oktoberfest events, cultural festivals"
2012,9,28,"'The worst movie I've ever seen,' Part II"
2012,9,26,TV Picks: Season premiere of 'Modern Family' on ABC
2012,9,23,People's Pharmacy: Statin interaction proved fatal
2012,9,14,Fall Arts Guide: Book and literary events
2012,9,5,Eric Church truly surprised by CMA nominations
2012,9,3,Plunging downhill in Vermont mountain-biking
2012,9,3,"Obama embraces 'Obamacare,' says it's here to stay"
2012,9,1,Disneyland for adults only
2012,9,1,Learning to love Disneyland again
2012,8,31,Trouble with the chair: Clint mocked for RNC bit
2012,8,30,'Side by Side': Tracking the evolution of digital filmmaking
2012,8,26,"Critics Picks: 'Monarch,' 'Somebody That I Used to Know' parodies, 'Injustice'"
2012,8,23,'Iron Sky': Out-of-this-world Nazi plot lands in chaos
2012,8,21,"TV Picks: 'Face Off,' 'America's Got Talent'"
2012,8,19,Microsoft's Gutierrez safeguards valuable trove of patents
2012,8,19,"13 top entertainment picks for the week of Aug. 19-25, 2012"
2012,8,14,Fantasy Football Fest will be in Atlantic City | NFL
2012,8,13,Be a litter fighter in the parks; Gates Foundation officially opens visitor center
2012,8,11,Troubled veterans left without health-care benefits
2012,8,7,TV Picks: 'Design Star All Stars'
2012,8,4,The beloved taco is subject of new research
2012,8,1,"Gore Vidal, celebrated author, playwright, dies"
2012,7,22,"Mariners go for series victory, try to score some runs as well"
2012,7,20,"Tom Davis, Al Franken's 'SNL' partner, dies in NY"
2012,7,18,Ex-Navy SEAL gets nearly 18 years in weapons case
2012,7,13,Books jockey for shelf space with other cherished collections
2012,7,6,Friday TV Picks: 'Mystery Diners' on Food Network
2012,7,6,Mich. soldier fights to recover after losing 4 limbs
2012,7,3,Iconic actor Andy Griffith a pivotal figure of his time
2012,6,27,ATF agent who started 'Fast and Furious' defends operation
2012,6,26,"TV Picks: 'Craft Wars,' U.S. Olympic swimming trials, 'Hell's Kitchen'"
2012,6,6,Surely not Princess Leia's 'Star Wars' — and other games
2012,6,3,'Icons of Science Fiction' show at EMP|SFM blasts off
2012,5,27,States to celebrate War of 1812 bicentennial
2012,5,25,Times-Picayune to cut paper to 3 days a week
2012,5,20,"'Avengers' sinks 'Battleship"" to remain No. 1"
2012,5,19,'Cheese and Culture': Blessed are the cheesemakers
2012,5,3,"STIFF, transgender, preservation fests unspool"
2012,5,1,Pop-performance artist up for UK's Turner Prize
2012,4,30,What would it take to become the Silicon Valley of Space?
2012,4,26,"Men are fans, too, of `Fifty Shades of Grey'"
2012,4,26,National Cathedral in DC restarts gargoyle tours
2012,4,24,Saints' Joe Vitt calls allegations in ESPN report 'ludicrous' | NFL
2012,4,20,'Kinect Star Wars': The Force is weak with this one
2012,4,15,Cinerama launches science-fiction film festival
2012,4,11,Community calendar
2012,4,11,Lucas empire strikes back in Calif. studio battle
2012,4,8,'Hunger Games' scores Easter feast with $33.5M
2012,4,8,"Best-sellers: Coben's 'Stay Close,' Lehrer's 'Imagine'"
2012,4,4,Panel told of effort to make PTSD diagnoses consistent
2012,4,4,Community calendar
2012,4,1,"'Lone Wolf,' 'American Sniper' are best-seller"
2012,3,30,"A war hero and moderate gets shoved aside by his party, the GOP"
2012,3,25,'Hunger Games' battles to $155M opening weekend
2012,3,25,Silly Movie Summaries contest winners -- we're still chuckling
2012,3,23,What goes around (and around): Beyblades spin into hot toy
2012,3,22,Ichiro museum opens window to Japan's baseball icon
2012,3,16,Friday TV Picks: 'In Plain Sight' returns to USA
2012,3,15,Muppet manifesto: Blistering exit for Goldman exec
2012,3,13,"'Hunger Games': Peer pressure? How about, like, fighting to death"
2012,3,11,Breakfast of champions or cereal killers?
2012,3,10,The week's passages
2012,3,9,Silly summaries contest winners announced
2012,3,9,"Dad-son talk, celebrity tweets key to viral video"
2012,3,7,Maker of Scene It? movie-trivia game shutting down
2012,2,19,Hollywood ambition meets SEALs secrecy in 'Act of Valor'
2012,2,14,Hitting a fashion show? Crazy heels required
2012,2,14,"Beach Boys, Radiohead, Chili Peppers play Bonnaroo"
2012,2,11,Chicago museum takes a look at the '80s
2012,2,10,Craft: Valentine's Day cards that stand out with 3-D elements
2012,2,10,3D doesn't improve 'Star Wars: Phantom Menace'
2012,2,9,Pentagon plan expands women's roles in military
2012,2,9,"At A Theater Near You: 'Star Wars' film in 3-D, 'Soul Train'"
2012,2,6,NBC broadcasts Super Bowl with pomp and promotion
2012,2,5,'Star Wars' game may reshape online world
2012,2,4,Super Bowl commercials breaking early
2012,2,4,Passages: notable deaths
2012,2,2,2012 Sasquatch! festival announced
2012,2,2,"Barking mad for Super Bowl ads and ""Puppy Bowl"""
2012,2,1,Guided-missile destroyer Shoup nears end of 7-month upgrade
2012,2,1,"Super Bowl advertisers go after ""second screens"""
2012,1,29,Elizabeth George's 'Believing the Lie' tops best-sellers' list
2012,1,26,"Space Cadet Gingrich, I want my planet back"
2012,1,23,New Legos aimed at girls raise questions about gender and play
2012,1,22,'Lego Friends' reinforce too many stereotypes about how girls play
2012,1,21,When the U.S. Red Cross rescued Russians
2012,1,20,Friday TV Picks: 'Shark Tank' on ABC
2012,1,19,'Fullmetal Alchemist: The Sacred Star of Milos': anime film for fans
2012,1,18,Russia urges quick missile defense deal with U.S.
2012,1,13,Bang for the buck and the home
2012,1,12,Astronomers: Most stars in galaxy have planets
2012,1,7,Our American Promise is at a crossroads View
2012,1,7,The week's passages
2012,1,2,Our challenge for 2012: Get Americans working
2011,12,31,Hope reigns as Americans prepare to ring in 2012
2011,12,30,Voice of Darth Vader swears in NY sheriff friend
2011,12,30,Book: Petraeus was urged to quit over Afghan drawdown
2011,12,28,Movie crowds dip to 16-year low as apathy lingers
2011,12,24,The Force is with 'Origami Yoda's' creator
2011,12,22,Medal of Honor story inflated by the Marines
2011,12,15,Entertaining book sets and activity kits for kids
2011,12,14,House to move ahead on defense bill
2011,12,13,Vets upset with 'Hawaii Five-O' crew at cemetery
2011,12,6,Dec. 7: A day that still lives in infamy for Arizona survivors
2011,12,3,Get crackin' with these omelets
2011,12,2,Great gifts for your geek
2011,11,30,Medvedev: New radar demonstrates Russia's might
2011,11,29,The top iPhone and iPad apps on App Store
2011,11,16,Vicki Noon shines in 'Annie Get Your Gun'
2011,11,11,The Columbia River Gorge management in peril from lack of two-state funding
2011,10,31,US home video spending up for 1st time since 2008
2011,10,29,Berlin's Brandenburg Gate welcomes again
2011,10,27,'Finding Joe': This journey lacks some bliss
2011,10,18,"Hats, hats and more hats at New York exhibit"
2011,10,18,New DVDs: 'Pirates of the Caribbean: On Stranger Tides'
2011,10,18,High court to rule on lying about military medals
2011,10,17,Pernilla August wins Nordic film prize
2011,10,13,Harry Potter studio to open for public tour
2011,10,6,'Sci Fi' pops program at Benaroya stars Jonathan Frakes
2011,10,5,Obituary: Apple co-founder and Silicon Valley pioneer Steve Jobs
2011,9,23,Two housing markets: rich and everyone else
2011,9,22,"In the US, 2 housing markets and 2 directions"
2011,9,17,The force is with fans at Star Wars statue
2011,9,15,'Star Wars'-type planet with two suns found
2011,9,15,Not just science fiction: Planet orbits 2 suns
2011,9,13,Twister among toy finalists for Hall of Fame
2011,9,7,Global solidarity didn't last after Sept. 11 attacks
2011,9,1,"In Sayles' 1900-set 'Amigo,' you'll see wars you recognize"
2011,8,27,"Best-selling books: 'A Dance with Dragons,' 'A Stolen Life'"
2011,8,24,Put on a hairy face
2011,8,22,"In Sayles' 'Amigo,' you'll see wars you recognize"
2011,8,22,TV Picks: 'Short Cuts'
2011,8,20,Seattleites enjoy hottest day of the year
2011,8,7,"For Star Wars fans, Calif's Yoda statue is a mecca"
2011,8,7,Castles and high-tech culture in Slovenia
2011,8,4,'The Man Who Fell to Earth': David Bowie arrives in longer version
2011,7,31,"In debt debate, pols drive off metaphorical cliff"
2011,7,29,'Horrid Henry' book series gets film treatment
2011,7,28,'Life in a Day': a dazzling kaleidoscope of YouTube moments
2011,7,27,Lucas loses UK battle over stormtrooper helmets
2011,7,21,'Captain America': A marvel of a superhero
2011,7,18,Libyan faithfully tends graves of foreign war dead
2011,7,16,What our writers love this week
2011,7,16,The week's passages
2011,7,15,Foodies feast on TV fare
2011,7,14,"Scarecrow Video recommendations for ""Harry Potter 7.2"""
2011,7,12,Lewis-McChord soldier who saved lives gets highest honor from Obama
2011,7,7,Friday TV Picks: 'Torchwood: Miracle Day' on Starz
2011,7,2,"For combat veteran, traveling memorial brings up tearful memories"
2011,6,29,Weekend calendar
2011,6,25,The week's passages
2011,6,23,Petraeus says he'll leave Army behind as CIA chief
2011,6,21,White House shuffles Afghan war team
2011,6,20,21-year-old Californian wins Miss USA crown
2011,6,19,Fanboy goes to Hollywood in Simon Pegg's memoir
2011,6,17,Pentagon dreams of Star Trek interstellar travel
2011,6,16,Pentagon dreams of 'Star Trek' interstellar travel
2011,6,16,"Scarecrow Video recommendations for ""Green Lantern"""
2011,6,12,Odd gadget & other E3 notes
2011,6,11,"Best-sellers: 'Dead Reckoning,' 'Those Guys Have All the Fun'"
2011,6,9,Panetta: Iraq will ask for some US troops to stay
2011,6,6,Microsoft out to show Xbox has got more game
2011,6,6,Nintendo's Wii successor to dominate E3 expo
2011,6,4,Ewan McGregor: 'I just look for stories that grab me'
2011,6,1,Fighting for his right to free expression
2011,5,31,Joint Chiefs pick is soldier-scholar _ and singer
2011,5,29,Military-themed games will be star of show at E3
2011,5,28,Soldier of many talents is likely pick to head U.S. military
2011,5,26,Relationship: Memorial Day 2011
2011,5,26,Game On: 'Dirt 3' hits pay dirt; 'Pirates' rates 'aargh' for 'rental'
2011,5,26,AP sources: Army chief picked to head Joint Chiefs
2011,5,23,"Once a year, it's hip to be square"
2011,5,23,"Theme parks opening new roller coasters, monster swings"
2011,5,20,'Star Wars' creator celebrates reopening of Disney World ride
2011,5,13,'SNL' alum Kristen Wiig walks 'Bridesmaids' down the aisle
2011,5,13,A tandoor oven brings India's heat to the backyard
2011,5,13,'Priest': Heaven help us
2011,5,12,"In Portland vs. Seattle rivalry, there's a history of flying fish, inflamed fans"
2011,5,12,Entrepreneur launches online fashion line for dogs
2011,5,11,Sis's own flair
2011,5,11,Dragon fruit has a knack for getting noticed
2011,5,10,Chess players making right moves at younger ages
2011,5,6,Weekend calendar
2011,5,5,Hours extended for 'Star Wars' exhibit's last days
2011,5,3,The summer movie season kicks off . . . with some nostalgia
2011,4,29,Tweetup with seattletimes.com on Star Wars Day
2011,4,25,Musicians clamor for answers from Philly Orchestra
2011,4,20,Weekend calendar
2011,4,19,A toy story of another sort
2011,4,19,Call up Facebook friends using T-Mobile
2011,4,19,T-Mobile enables voice calls to Facebook friends
2011,4,19,2011 Pulitzer winners in journalism and arts
2011,4,18,Dems: Sanchez likely to run for Texas Sen. seat
2011,4,13,Review: 'Your Highness' drowns in lowbrow humor
2011,4,9,"Why buy a horse, when you can get a cow for free?"
2011,3,30,Weekend calendar
2011,3,30,Make an interplanetary pilgrimage to Aberdeen's Star Wars shop
2011,3,30,Lawmakers seek answers on Libya
2011,3,26,Familiar faces of local TV pitchmen
2011,3,23,Thursday TV Picks: 'Fairly Legal' on USA
2011,3,23,Weekend calendar
2011,3,20,Nintendo 3DS: It's a new kind of fun
2011,3,18,Star Wars Exhibit comes to Pacific Science Center View
2011,3,18,Seattle exhibit lets the science of 'Star Wars' be with you
2011,3,17,"'Paul': The truth of a fun, fresh comedy is out there"
2011,3,16,"Best bets for this weekend: Robots, 'Star Wars' and Port Townsend history"
2011,3,16,Weekend calendar
2011,3,16,"Simon Pegg and Nick Frost do ""Star Wars"""
2011,3,9,Upcoming events around Western Washington
2011,3,7,Winter play in the French Alps — without skiing
2011,3,7,Stormtrooper fight goes to Britain's Supreme Court
2011,3,5,Emerald City Comicon: Comics-fan nirvana in Seattle
2011,3,3,Ruby's presence shakes up staid Vienna Opera Ball
2011,3,3,"Superman's mom, and more odds and ends"
2011,3,2,"Best bets among coming events: dog show, daffodils and Star Wars"
2011,3,1,"Last WWI doughboy, dies at 110 in W.Va."
2011,2,28,Last living US WWI vet dies in W. Va. at age 110
2011,2,18,"'Big Mommas: Like Father, Like Son': Martin Lawrence is just a drag"
2011,2,16,Stormwatching and cultural riches in Neah Bay View
2011,2,14,"New DVDs | 'Unstoppable,' 'Waiting for ""Superman,"" ' 'You Will Meet a Tall Dark Stranger'"
2011,2,14,Budget 'Star Wars': Will the force be with Obama?
2011,2,14,"Fiennes modernizes Shakespeare's ""Coriolanus"""
2011,2,10,Friday TV Picks: Tim McGraw on NBC's 'Who Do You Think You Are?'
2011,2,4,Reagan legacy weighed amid 100th birthday events
2011,2,3,Reagan myth can obscure Reagan the man
2011,1,27,Reclaim your refrigerator: Ideas for displaying kids' art
2011,1,27,Ant Farm co-inventor Milton Levine dies at 97
2011,1,18,"Amid drug violence, Acapulco watches tourism recede"
2011,1,16,"Happy 10th to Wikipedia, and it's just getting started"
2011,1,10,Five far-away places to remember — and revisit
2011,1,8,The Week Ahead: 'Somewhere' and new group Case Studies are A&E highlights
2011,1,1,War hero's tour: a humble soldier adjusts to fame
2010,12,28,Top brass avoid blame as Army edits history of deadly Afghan battle
2010,12,28,The Force is strong: 'Empire' tapped for registry
2010,12,23,'Gulliver's Travels': a big Jack Black adventure with little drive to it
2010,12,23,Robot waiters in China never lose patience
2010,12,22,Former Afghan commander McChrystal writing memoir
2010,12,22,Final goodbye: A roll call of some who died in '10
2010,12,18,Bill Burton has built his vision for a safe place to play and learn View
2010,12,18,Swap before you shop: Online toy exchanges catch on this Christmas
2010,12,15,Frugal parents skip stores for online toy swaps
2010,12,13,Navy claims barrel-force record with supersonic shell
2010,12,10,Laser incidents on rise; aviation officials worried
2010,12,6,Executive finds fountain of youth in toys
2010,12,4,The week's passages
2010,12,1,Weekend calendar
2010,11,30,'Empire Strikes Back' director Irvin Kershner dies
2010,11,28,Filmmakers use the Web to amuse and bond with fans
2010,11,12,A no-stress Disney World vacation
2010,11,11,Disabled veterans memorial has DC groundbreaking
2010,11,4,The shameful prosecution of Omar Khadr
2010,11,2,"Game On: ""Vanquish"" lags; ""Force Unleashed"" lacks originality"
2010,11,2,Robot's space debut 'giant leap for tinmankind'
2010,10,30,McCain: Angle will help GOP seize Senate control
2010,10,27,Original Darth Vader costume up for sale in London
2010,10,25,"New DVDs | 'The Girl Who Played With Fire,' 'Sex and the City 2,' 'Winter's Bone'"
2010,10,19,"Tangier: Close to Europe, yet worlds apart"
2010,10,8,"National security shuffle: Jones out, Donilon in"
2010,9,30,Highlights of live chat with Jay Buhner
2010,9,27,Actress widens Star Wars' universe
2010,9,24,"FBI serves terrorism warrants in Minn., Chicago"
2010,9,23,"Eddie Fisher dies; 5 marriages included Debbie Reynolds, Liz Taylor"
2010,9,21,Military gay ban becomes election-year hot button
2010,9,13,Review: 'Halo: Reach' more fun with more than 1
2010,9,10,First Medal of Honor for a living Afghan war vet
2010,9,10,'Resident Evil: Afterlife': Somebody stop Paul Anderson from making these things
2010,9,8,Clooney and Knightley in London Film Fest entries
2010,9,2,USA TODAY BEST-SELLERS
2010,9,2,The Stig's ID is 'Top Gear' secret no more
2010,9,1,"President Obama's impossible missions: Israeli-Palestinian peace, Sunni-Shiite tolerance"
2010,8,31,"Time to get your flu shot, but just one this year"
2010,8,26,Retired generals wary of Gates plan to downsize Pentagon from top
2010,8,25,Ambitious and civic-minded and 16
2010,8,22,Islamic center debate stupefies Muslim world
2010,8,18,Weekend calendar
2010,8,14,'Star Wars' fans star in new Lucasfilm project
2010,8,14,Where were you when 'Star Wars' first opened? You can look it up in 'Star Wars: Year by Year'
2010,8,10,Eaten alive: 5-year battle with flesh-eating germ
2010,8,7,General's moody portrait wins fans at Pentagon
2010,8,5,Supermodel testifies about 'blood diamonds'
2010,7,29,Sucked deeper into Afghanistan's confusing maze
2010,7,22,Cash cow for contractors
2010,7,20,A dream job: Hans Zimmer and the music of 'Inception'
2010,7,20,Storm troopers get ready to invade Comic-Con
2010,7,9,Video game: 'LEGO Harry Potter' is magical
2010,7,7,"'BlackLight' debuts on Xbox; comic books, movie are next"
2010,7,1,Lucasfilm loses pregnancy lawsuit in California
2010,6,30,Pentagon recommends Medal of Honor for a living soldier
2010,6,26,Military policy keeps savvy officers from suitable promotions
2010,6,21,"New DVDs | 'The Last Station,' 'Green Zone,' 'She's Out of My League,' 'Remember Me'"
2010,6,16,"Petraeus slumps at Hill hearing, quickly recovers"
2010,6,13,Microsoft on move with Kinect
2010,6,13,Bracketed by crimes: Van der Sloot's last 5 years
2010,6,12,Stieg Larsson's 'Hornet's Nest' tops the best-seller list
2010,6,11,A sneak peek at Harry Potter theme park in Orlando
2010,5,21,US intelligence chief out; who's next in hot seat?
2010,5,21,Intelligence director knew his days were numbered
2010,5,20,Scarecrow suggests | Like 'Shrek Forever After'? Try other franchises' so-called 'final chapters'
2010,5,9,Research into childhood illness hits home
2010,5,6,"Well, that's a brilliant idea"
2010,4,30,Letterman putting life back together after scandal
2010,4,29,Elite Air Force fighters awarded medals
2010,4,28,"After ho-hum theme night, hard to predict who will leave 'Idol' tonight"
2010,4,25,Army general is point man in Pentagon's push to improve soldiers' welfare
2010,4,23,"New way to guide a car: With your eyes, not hands"
2010,4,15,'I Shouldn't Be Alive' on Animal Planet is a Friday TV pick
2010,4,12,"Iron Man, Bella, Robin Hood fan summer film action"
2010,4,8,Friday's TV Picks include 'High Society'
2010,4,6,'Star Wars' headed to TV as an animated sitcom
2010,4,4,Geek Squad a killer app for Best Buy
2010,4,3,"A year later, Northgate condos still all unsold"
2010,4,1,What's hot in Hollywood collectibles
2010,3,31,No formal reprimand for general who pushed gay ban
2010,3,28,Players say joy comes from ukulele's sound
2010,3,27,'House rules' and 'Chelsea Chelsea Bang Bang' top the best-seller lists
2010,3,25,Military to relax rules on gays serving until law passed
2010,3,25,Pentagon eases enforcement of ban on gays
2010,3,24,Military to tighten rules on gay firings
2010,3,17,Petraeus: 'Time has come' to rethink gay policy
