year,month,day,title
2016,12,8,'Rogue One' moves 'Star Wars' forward by going back
2016,12,8,Katie Holmes probes mom-daughter bond in directorial debut
2016,12,6,Drake tops iTunes' year-end music lists
2016,12,4,Carter confident his successor will be ready to take command
2016,12,4,"Leftovers 'Moana,' 'Fantastic Beasts' rule box office again"
2016,12,3,"""Rogue One"" director Gareth Edwards has a cameo in the film"
2016,12,3,Disney teases 28 minutes of 'Star Wars' spinoff 'Rogue One'
2016,12,3,'This means war' — New AP book draws on Pearl Harbor reports
2016,12,2,Wacky gifts for the tech-savvy person who has everything
2016,12,2,Trump to nominate retired Gen. James Mattis to lead Pentagon
2016,12,1,"Trump to nominate Washington native, retired Gen. James Mattis, to lead Pentagon"
2016,11,27,'Moana' cruises with $81.1M Thanksgiving weekend
2016,11,24,"After the turkey, some hit the shops to start holiday season"
2016,11,23,Australian 'Star Wars' actor Peter Sumner dies at 74
2016,11,23,Tis the season of movies: get excited about these new films
2016,11,20,AP: Too quiet on the set; filming accidents often go untold View
2016,11,20,Q&A: Target's chief merchandising officer Mark Tritton
2016,11,16,Carrie Fisher reveals 'Star Wars' affair with Harrison Ford
2016,11,15,GOP governors hope to move fast on making promised changes View
2016,11,15,Beauty & the Beast is a tale as old as time — with surprises
2016,11,11,Murphy Oil sinks along with crude; Nvidia soars
2016,11,10,Business Highlights
2016,11,10,Disney embraces streaming as ratings sag
2016,11,10,Supervisors say George Lucas museum belongs in Los Angeles
2016,11,9,Syrian teens tell UNICEF envoy Liam Neeson about tough exile View
2016,11,6,Awards-season campaigning underway at Hollywood Film Awards View
2016,10,27,Correction: Twitter-In Need Of Change story
2016,10,25,'Atlanta' memes give cast member Brian Tyree Henry the feels
2016,10,24,General Mills milks Girl Scout Cookie popularity with cereal
2016,10,23,Toy companies break down barriers to be more inclusive
2016,10,21,Donald Glover cast as Lando Calrissian in Han Solo film
2016,10,20,Toy companies break down barriers to be more inclusive
2016,10,18,Robotic scan for horses could hold promise for human health
2016,10,17,Sexy costumes are out; Pokemon is in this Halloween
2016,10,16,"LEADING OFF: Bauer, Indians take 2-0 ALCS lead into Toronto"
2016,10,16,Cleveland's Bauer brings drone to news conference
2016,10,13,Watch the final trailer for 'Rogue One: A Star Wars Story' Watch
2016,10,13,"Obama's favorite sci-fi films include '2001,' 'Blade Runner'"
2016,10,12,Business Highlights
2016,10,12,Film firm fined over Harrison Ford 'Star Wars' set accident
2016,10,9,"Voters call debate 'cringe worthy,' some won't cast ballot View"
2016,10,7,Forest Whitaker joins 'Black Panther' cast
2016,10,6,"Community calendar: festivals, fairs and more"
2016,10,5,Vuitton gives star-filled happy ending to dark Paris season View
2016,10,3,Pittsburgh symphony strike cancels events through Oct. 27
2016,10,3,Drone footage reveals Bertha’s exit point as the boring machine reaches halfway point Watch
2016,10,3,Rockwell museum gets $1.5M grant from 'Star Wars' creator
2016,10,2,SpaceX founder Musk endeavors to find perfect starship name
2016,10,2,‘Star Wars’ troopers march to museum
2016,9,30,A topical disc from rock 'n' roll's Southern conscience
2016,9,30,SpaceX's Elon Musk turns to science fiction for Mars ship View
2016,9,28,"Stars expose problems, seek solutions on 'America Divided'"
2016,9,28,Savvy strategy for betting on a fad also considers its end
2016,9,27,"Shimon Peres witnessed Israel's history, and shaped it View"
2016,9,27,Debate Takeaways: Clinton gets under Trump's skin in debate
2016,9,26,Debate takeaways: Clinton gets under Trump's skin in debate
2016,9,26,Sept. 26 TV Picks: ‘Kevin Can Wait’ on CBS
2016,9,24,Saving the big box: Inside the plan to revive Toys R Us
2016,9,22,Shareblue galvanizes Twitter army to voice outrage on Clinton’s behalf
2016,9,21,"3 years after '12 Years,' Nyong'o's face is back on screen View"
2016,9,18,"The Latest: Emmy winners wined, dined at Governor's Ball View"
2016,9,17,Get thee to a theater: 2016-17 promises a hot season for Seattle stages Watch
2016,9,16,'Fifty Shades' trailer breaks 'Force Awakens' record online
2016,9,16,Force Awakened: Man in Darth Vader garb slays galaxy garbage
2016,9,16,Force Awakened: Man in Darth Vader garb slays galaxy garbage
2016,9,15,Service chiefs urge lawmakers to avoid return of budget caps View
2016,9,15,'South Park' mocks anthem controversy in season premiere
2016,9,14,"Disney closes Bellevue game studio, lays off 61"
2016,9,14,'Star Wars' films land at Turner networks in exclusive deal
2016,9,13,‘Training’ gets new meaning for runners
2016,9,10,The Motley Fool: Useful tips on investing
2016,9,10,"As Seahawks season opens on 9/11 anniversary, nation wonders: What forms of protest are patriotic?"
2016,9,8,"‘Star Trek’ theme song has lyrics? Yes, it does"
2016,9,8,Live long and prosper: 'Star Trek' turns 50
2016,9,6,New study finds inequality unchanged in Hollywood
2016,9,4,'Don't Breathe' tops box office again over Labor Day weekend
2016,9,2,"50 years on, ‘Star Trek’ endures"
2016,9,2,Fall Movie Preview: Highlights from September to December View
2016,9,1,"Bargains, outdoor movies: ‘Lights Out,’ ‘Star Wars: The Force Awakens,’ ‘Nine Lives’"
2016,8,30,10 things to look forward to at the movies this fall View
2016,8,29,Kaepernick's decision to sit through anthem scrutinized
2016,8,26,"Meet octobot, a soft-bodied robot that looks like the future"
2016,8,26,UW gymnastics coach Elise Ray in good place after overcoming Olympic disappointment
2016,8,25,"Bargains, outdoor movies: ‘Absolutely Fabulous,’ ‘Gleason,’ ‘Labyrinth’"
2016,8,23,"Parrot that can do wolf whistle, sounds like R2-D2 is on lam"
2016,8,22,Disabled California man seeks to have voting rights restored
2016,8,22,Mark Hamill supports terminally ill 'Star Wars' fan
2016,8,21,Donald Trump’s roots: a German immigrant saga that runs through the Northwest
2016,8,18,See Disney’s ‘Frozen’ in the park; ‘Thelma & Louise’ back on screens for anniversary
2016,8,15,Monday TV Picks: ‘Major Crimes’ summer run
2016,8,13,"Kenny Baker, who played R2-D2 in 'Star Wars,' dead at 81"
2016,8,11,It’s playtime at MOHAI’s toy exhibit View
2016,8,9,Disney's movie hits overshadow lackluster TV results
2016,8,5,Will truce in swimsuit wars carry on past Rio Olympics?
2016,8,4,Kiefer Sutherland's next act; 'black-ish' aims for everyone View
2016,8,4,New ABC chief: seeking diversity in 'Bachelor' franchise
2016,8,4,Daisy Ridley off Instagram after anti-violence post
2016,8,4,"Bargains, outdoor movies: ‘Captain America,’ ‘The Lobster,’ ‘Finding Nemo’"
2016,8,3,Fly me to the moon: Feds OK private firm's lunar flight plan
2016,8,3,"Trump, magnet for discord and disruption, outdoes himself this week"
2016,8,2,Trump accepts a Purple Heart amid veteran controversy
2016,8,2,San Francisco's northernmost suburb? Tales of Seattle housing and real estate
2016,8,2,Quotations in the News
2016,8,1,Military families to Trump: Apologize for comments to Khans
2016,8,1,Criticism grows for Trump's assailing of Muslim vet's family
2016,7,31,"Timberlake, Alba bring seriousness to Teen Choice Awards View"
2016,7,29,Romanian students celebrate Microsoft Imagine Cup victory
2016,7,29,"Yes, Harrison Ford uses checklists when he flies"
2016,7,28,"Yes, Harrison Ford uses checklists when he flies"
2016,7,28,"Bargains / outdoor movies: ‘Indiana Jones,’ ‘Conjuring 2,’ ‘Aladdin’"
2016,7,27,Creator of Broadway hit 'Hamilton' visits Puerto Rico
2016,7,26,"Prosthetic leg stolen from boy, 4, at California beach"
2016,7,26,Film company guilty in 'Star Wars' accident that broke Harrison Ford's leg
2016,7,25,Wish granted: garbage man for a day to sick Sacramento boy
2016,7,24,Breaking down the gender stereotypes in kids' clothing
2016,7,20,"Comic-Con launches with preview night, 'Trek' premiere View"
2016,7,19,John Williams greets 'Star Wars' musicians outside home
2016,7,19,Seattle filmmaker’s movie gets national release
2016,7,19,Netflix’s ‘Stranger Things’ is creepy <em>and</em> sweet
2016,7,19,'Star Trek Beyond' gracefully finds orbit amid tragedy
2016,7,19,Live from the RNC: Donald Trump officially nominated as Republican candidate for president Watch
2016,7,18,John Williams greets 'Star Wars' musicians outside home
2016,7,16,Amazon's Jeff Bezos gets cameo in new 'Star Trek' film
2016,7,15,Hollywood reacts to 'Pokemon Go' craze
2016,7,14,AP EXCLUSIVE: Militant with US bounty walks free in Pakistan View
2016,7,13,July 15 TV Picks: ‘The Great British Baking Show’ on KCTS
2016,7,12,"Toilet bowl night light, anyone? 7 unusual deals spotted on Prime Day View"
2016,7,9,Seattle-area Somali community unites to embrace state’s new child-care standards
2016,7,7,Wine and song: Boston Symphony back outdoors at Tanglewood
2016,7,4,Odd couple Israel and Egypt enjoying 'best times ever'
2016,7,3,Send thousands of kids back to school with everything they need
2016,7,2,Q&A: Chicago park defender unapologetic on Lucas Museum fray View
2016,6,30,Moviegoers to Hollywood: It better be good
2016,6,29,It’s outdoor movie season: Where to watch films around Seattle and the Eastside
2016,6,29,"Coming to Hulu in July: ‘Terminator Genisys,’ ‘East Los High,’ ‘Elementary’"
2016,6,28,'Avatar' mobile game landing ahead of film sequels
2016,6,24,Lucas abandons plan to build museum in Chicago after lawsuit
2016,6,22,"No matter the job, passion is key in space ventures"
2016,6,20,TV series on Michael Jackson's final days in development
2016,6,19,Group suing to stop Lucas museum outlines settlement options
2016,6,16,"Community calendar: festivals, fairs and more"
2016,6,16,Lin-Manuel Miranda leaving 'Hamilton' July 9; vows to return
2016,6,15,"Tokyo, Paris, now Shanghai: Small world for Disney parks View"
2016,6,15,TV Picks for June 15: ‘Another Period’ brings history to raunchy life
2016,6,14,"VR hardware is here, but robust game lineup isn’t"
2016,6,13,Scientists discover largest planet orbiting 2 suns to date
2016,6,12,EA teases new 'Star Wars' games at E3
2016,6,12,"'Conjuring 2' scares up $40.4M, breaking sequel slump"
2016,6,11,"From virtual reality to androids, 5 expectations for E3"
2016,6,10,"As game makers try new tactics, a turning point for E3"
2016,6,10,"Spielberg, Lucas salute composer John Williams at AFI gala View"
2016,6,3,The week’s passages View
2016,6,2,"Movie bargains: ‘Zootopia,’ ‘The Nice Guys,’ ‘Mother’s Day’"
2016,6,1,Richard Sherman insists Seahawks defense is still second to none
2016,6,1,University offers scholarships to Chewbacca mom's family
2016,5,31,The spy we’d love to see: Gillian Anderson as 007
2016,5,29,Libertarian Party sees its big chance this presidential year
2016,5,29,Love and grief are legacy of latest U.S. combat death Watch
2016,5,27,Looking ahead to 100 more years at the Indianapolis 500
2016,5,27,Chinese developer Wanda opens theme park to take on Disney View
2016,5,26,"‘Wheedle’s Groove,’ a fan remake of ‘Raiders of the Lost Ark’ and more"
2016,5,26,"Movie bargains: ‘A Hologram for the King,’ ‘Batman v Superman’"
2016,5,25,The Greatest Spectacle in Racing remains an American icon View
2016,5,24,'Star Wars' actor Peter Mayhew to meet 'Chewbacca Mom'
2016,5,23,New Mexico joining effort to rehabilitate historic theaters
2016,5,23,Chewbacca Mom's infectious laugh draws more than 137M views
2016,5,19,"Movie bargains: ‘Race,’ ‘Fight Club,’ ‘Criminal,’ ‘The Witch’"
2016,5,19,"Deputies strike back at Dark Side, arrest storm trooper"
2016,5,17,The top 10 movies on the iTunes Store
2016,5,13,SassyBlack says new album is trippy and so are you
2016,5,12,The pursuit of young filmmakers — and ‘Happyness’
2016,5,12,"The Week Ahead: Beyoncé, free ice cream and a ‘Star Trek’ salute"
2016,5,12,Chicago park group: Lucas Museum case shouldn't be dismissed
2016,5,11,Lucasfilm and Disney launching 'The Star Wars Show' online
2016,5,11,AP Explains: Bias complaints on Facebook's 'trending' tool
2016,5,10,Disney's movie business is again playing a starring role
2016,5,10,"Disney shutting Infinity game unit, cutting 300 jobs"
2016,5,9,May 9 TV Picks: ‘12 Monkeys’ on Syfy
2016,5,6,Mariners' latest clubhouse hijinks: What is the rally 'swelmet'?
2016,5,6,KJR radio host Dave ‘Softy’ Mahler has love-hate relationship with Seattle sports fans Watch
2016,5,6,Vinyl revival: Czech record maker aims for global dominance View
2016,5,5,"For virtual reality makers, a new version of an old struggle"
2016,5,5,Bertha gets its own 'Star Wars' supercut Watch
2016,5,5,"Movie bargains: ‘April and the Extraordinary World,’ ‘Miracles from Heaven’"
2016,5,5,"Community calendar: festivals, fairs and more"
2016,5,5,"Home Viewing: ‘Star Wars: The Force Awakens, ‘Joy,’ ‘Grace and Frankie’"
2016,5,5,"'Jungle Book,' Warner Bros. big winners at trailer awards"
2016,5,4,It's Star Wars Day: May the 4th be with you
2016,5,3,This drone footage of inside Bertha’s tunnel is like something out of ‘Star Wars’ Watch
2016,5,3,Developer of proposed Lucas museum looking outside Chicago
2016,5,1,'Family Guy' creator to sing with Boston Pops opening night
2016,5,1,Family Guy creator to sing with Boston Pops opening night
2016,4,28,Mariners minor league report: Class A Bakersfield scores eight runs in two innings for a late comeback win
2016,4,28,"Movie bargains: ‘Where to Invade Next,’ ‘Hail, Caesar!’"
2016,4,26,"Amazon, Microsoft execs push for computer-science education, give $23 million to Code.org"
2016,4,21,"Movie bargains: ‘Demolition,’ ‘Creed,’ ‘10 Cloverfield Lane’"
2016,4,20,Serbia's PM Vucic likely to solidify power in snap vote
2016,4,20,"At Disney, running a race is all about the costume"
2016,4,19,The top 10 movies on the iTunes Store
2016,4,19,"Empire strikes back: William, Harry visit 'Star Wars' set View"
2016,4,18,"Netflix and Taser slide, Hasbro and Amazon trade higher"
2016,4,18,'Impossible' director Bayona set for 'Jurassic World' sequel
2016,4,17,Actress Carrie Fisher to be honored by Harvard student group
2016,4,16,Sean Parker plays coy as Screening Room VOD debate heats up
2016,4,15,"J.J. Abrams and Chris Rock talk films, comedy and being nice"
2016,4,14,"The Week Ahead: Cherry blossoms, tulips and Paul McCartney"
2016,4,14,"Movie bargains: ‘The Revenant,’ ‘The Hateful Eight’"
2016,4,14,Sean Penn's 'The Last Face' competing at Cannes festival View
2016,4,12,"Ben Affleck to direct Batman film, Warner Bros. chief says"
2016,4,12,Original 'Star Wars' trilogy heading back to theaters
2016,4,11,"Paramount teases 'Baywatch,' confirms 'Fences' at CinemaCon"
2016,4,9,List of winners from the 2016 MTV Movie Awards
2016,4,9,'The Force Awakens' wins top honors at MTV Movie Awards View
2016,4,8,Wanted: Creative types to shape the personalities of virtual assistants
2016,4,7,Chronological timeline of the 'Star Wars' cinematic universe
2016,4,7,"Movie bargains: ‘Kung Fu Panda 3,’ ‘Gods of Egypt’"
2016,4,7,New 'Star Wars' trailer previews the story of rebels past
2016,4,7,"Home Viewing: ‘Star Wars: The Force Awakens,’ ‘11.22.63,’ Tower Records doc ‘All Things Must Pass’"
2016,4,6,Lupita Nyong'o still basking in glow of 2014 Oscar win
2016,4,1,Indonesia threatens to bar DiCaprio over rainforest comments
2016,3,31,"Movie bargains: ‘Spotlight,’ ‘Brothers Grimsby,’ ‘Star Trek II’"
2016,3,29,Center on Contemporary Art pops up again with whack-a-mole vitality
2016,3,29,"Just like magic, ticket prices at Universal Studios Hollywood rise"
2016,3,28,'Batman v Superman' gross revised down to $166.1 million
2016,3,26,Some see Chicago’s mayor returning to the dark side to help George Lucas’ museum
2016,3,25,'Batman v Superman' strong-arms Thursday box office sales
2016,3,24,"Movie bargains: ‘Star Wars,’ ‘Eddie the Eagle,’ ‘Carol’"
2016,3,21,"Box Office Top 20: 'Allegiant' falters, 'Miracles' ascends"
2016,3,19,Flagstaff kids among cast 'Finding Nemo' in Navajo
2016,3,19,"With orca changes, SeaWorld must live without iconic Shamu"
2016,3,18,Director Rian Johnson's ex-agent sues over 'Star Wars' work
2016,3,16,"Animated movies hit high point; so do studios’ costs, potential rewards"
2016,3,16,College goes on lockdown after light saber mistaken for gun
2016,3,15,The big business behind the adult coloring-book craze
2016,3,15,"PlayStation VR to debut in October for less than Rift, Vive"
2016,3,15,'Indiana Jones' to return with Ford and Spielberg
2016,3,14,Box Office Top 20: 'Zootopia' stays on top with $51.3M
2016,3,14,"‘The Americans’ returns, full of secrets"
2016,3,13,"'10 Cloverfield Lane' opens well, but 'Zootopia' roars"
2016,3,13,"'Star Wars' wins, John Stamos slimed at Kids' Choice Awards"
2016,3,11,Dubai official warns of 'clash of civilizations' over Trump
2016,3,10,"'Spring Break for nerds' kicks off Friday in Austin, Texas"
2016,3,10,Saudi Arabia concludes 20-nation anti-terror military drill
2016,3,9,Missouri religious exemption measure advances
2016,3,8,"Leonys Martin’s outfield arm is a sight to behold for fans, Mariners teammates"
2016,3,8,'The Force Awakens' leads MTV Movie Awards nominees
2016,3,7,Box Office Top 20: 'Zootopia' rises to record $75 million
2016,3,6,"'Zootopia,' 'London Has Fallen' dethrone 'Deadpool'"
2016,3,4,"Tony Dyson, who made beloved robot R2-D2, dies in Malta"
2016,3,4,"Cruising news in 2016? Diving capsule, mammoth ships and a sky ride"
2016,3,3,Disneyland to start building its ‘Star Wars’ land in April
2016,3,3,'Star Wars: The Force Awakens' comes to home video in April
2016,2,29,'Deadpool' earns $31.1M in third weekend
2016,2,28,"Trump mesmerizes critics, admirers in Europe"
2016,2,27,Disney moves to demand-based pricing at theme parks
2016,2,27,Disney to roll out seasonal pricing on one-day park tickets
2016,2,26,"An Oscar win can give a boost to a career, but not always"
2016,2,25,‘Only Yesterday’: Anime studio delivers a visual and vocal treat
2016,2,25,"Diversity must play a role in Oscar show, but not the lead"
2016,2,25,"Netflix’s ‘Fuller House’ takes us back to the Tanner family, with a few updates, no Olsen twins"
2016,2,25,People to watch at the Oscars
2016,2,22,Box Office Top 20: 'Deadpool' stays on top with $56.5M
2016,2,21,'Deadpool' dominates again with $55 million in 2nd week
2016,2,21,‘When Breath Becomes Air’ tops nonfiction best-sellers list
2016,2,19,Star Wars blitz continues at Walt Disney World
2016,2,18,'Fallout 4' crowned game of the year at DICE Awards View
2016,2,18,"'Star Wars,' Bowie tributes top Boston Pops' spring lineup"
2016,2,17,Judge warns Chicago about starting Lucas Museum construction
2016,2,16,Box Office Top 20: Reynolds' 'Deadpool' marks historic debut
2016,2,16,Celebrity birthdays for the week of Feb. 21-27
2016,2,15,"Complete list of Grammy winners, nominees"
2016,2,15,Argentine alien festival soars at UFO sighting site hotspot View
2016,2,15,10 Things to Know for Tuesday
2016,2,15,"'Star Wars: Episode VIII' starts filming, adds del Toro"
2016,2,14,List of winners at the 2016 British Academy Film Awards
2016,2,14,"Big 'Deadpool' debut annihilates 'Fifty Shades' record, more"
2016,2,14,‘When Breath Becomes Air’ retains top nonfiction sales spot
2016,2,14,'The Revenant' and DiCaprio are winners at BAFTA film awards View
2016,2,13,"Munn, Segel help film academy honor inventors, engineers"
2016,2,13,Head of BAFTA: Film industry not diverse enough
2016,2,11,"As 'Force Awakens' winds down, 'Avatar' remains supreme"
2016,2,11,'Star Wars' producers charged over Harrison Ford accident
2016,2,9,Sports costs at ESPN weigh down Disney's Force-ful quarter
2016,2,8,Box Office Top 20: 'Kung Fu Panda' roars past the Coens
2016,2,8,Producer Dave Cobb goes from outsiders to influencers
2016,2,7,'Kung Fu Panda 3' tops Super Bowl weekend at box office
2016,2,7,‘Blue’ soars to top of hardcover fiction list
2016,2,5,Vote: Do Super Bowl ads make you want to buy?
2016,2,4,"Tattoos, martial arts and poker? Casinos wooing millennials"
2016,2,4,"Movie bargains: ‘Humpday,’ ‘Suffragette,’ ‘The Forest’"
2016,2,4,Latin America scrambles to squash Zika-spreading mosquito View
2016,2,4,Judge: Suit seeking to stop Chicago Lucas Museum can go on
2016,2,3,"Glitter, feathers, paint: New Orleans preps for Mardi Gras View"
2016,2,2,"'Star Wars,' 'Jurassic World' among Kids Choice nominees"
2016,2,1,Box Office Top 20: 'Kung Fu Panda 3' dethrones 'Revenant'
2016,1,31,'Kung Fu Panda 3' tops box office; 'Finest Hours' flounders
2016,1,31,‘My Name Is Lucy Barton’ tops hardcover fiction list
2016,1,31,"The Short List: 3 actors we love this week, including SAG winner Idris Elba"
2016,1,30,The Latest: Trump gives money to veterans charity View
2016,1,29,"Xerox, Microsoft and Honeywell rise while Amazon skids"
2016,1,29,US stocks soar to finish tough month as tech stocks climb
2016,1,28,"Movie bargains: ‘Bridge of Spies,’ ‘Creed,’ ‘Groundhog Day’"
2016,1,27,Hasbro should know that courage has no gender
2016,1,26,Jan. 26 TV Picks: ‘Hollywood Game Night’ on NBC
2016,1,25,Box office top 20: 'The Revenant' on top with $16 million
2016,1,25,"Thurman, Ora at Paris couture as Dior shows without designer View"
2016,1,24,'The Revenant' braves the blizzard with $16M at box office
2016,1,24,Marie Kondo’s ‘Spark Joy’ grabs top nonfiction books spot
2016,1,23,'Big Short' wins Producers award; #OSW crisis also in room
2016,1,21,"Movie bargains: ‘Bridge of Spies,’ ‘Concussion,’ ‘Everest’"
2016,1,21,"Looking for diversity, Hollywood could turn on the TV"
2016,1,20,"Path to reform for Oscars starts with studios, academy"
2016,1,20,'Star Wars: Episode VIII' release delayed to Dec. 2017
2016,1,19,Box office top 20: 'Ride Along 2' and 'The Revenant' on top
2016,1,19,Average movie ticket up to a record high of $8.70
2016,1,18,'Ride Along 2' ends box office reign of 'Force Awakens'
2016,1,17,10 Things to Know for Monday
2016,1,17,"'Spotlight,' DiCaprio, Larson win at Critics' Choice Awards View"
2016,1,17,‘The Girl on the Train’ steams ahead atop bestellers list
2016,1,16,"Actor, California lawmaker fight bogus memorabilia"
2016,1,16,Broncos vow not to make same mistake and overlook Steelers View
2016,1,16,Louis C.K. still mulling future of 'Louie'
2016,1,15,What does Obama carry in his pocket? Find out on YouTube
2016,1,14,Lack of diversity in Oscar nominations renews debate
2016,1,14,Titles from video-game franchises top sales rankings
2016,1,14,"Movie bargains: ‘Bridge of Spies,’ ‘The Peanuts Movie’"
2016,1,14,A complete list of the 2016 Oscar nominations
2016,1,14,"Oscar surprises: Only 8 movies, Charlotte Rampling"
2016,1,14,"Oscar snubs: Where were Idris Elba, Helen Mirren, ‘Creed’?"
2016,1,14,List of 88th annual Academy Award nominations is announced
2016,1,14,‘Revenant’ leads Oscar noms with 12; only white actors again
2016,1,14,The Latest: Jennifer Jason Leigh wakes up to an Oscar dream
2016,1,13,Oscar nominations announced: 'Revenant' leads the list
2016,1,12,Business Highlights
2016,1,12,'Homeland' to set and film in New York City
2016,1,12,#wheresrey? Disney says more 'Star Wars' heroine toys on way
2016,1,12,'Star Wars' stays on top despite surge from 'The Revenant'
2016,1,12,Rant & Rave: Love the #12 sign
2016,1,11,TV Picks for Jan. 11: ‘The Biggest Loser’ on NBC
2016,1,10,"Will ‘Carol,’ ‘Big Short’ get a big Oscar bump from Golden Globes?"
2016,1,10,'Star Wars' tops DiCaprio in 'Revenant' to stay No. 1
2016,1,10,"Book trends in 2016: Paper is popular, science fiction rises, long-form nonfiction dips"
2016,1,10,Predicting Oscar: Our movie critics take a shot at reading the Academy’s mind
2016,1,9,Abrams skirts Oscars talk for 'Star Wars: The Force Awakens'
2016,1,8,Record-breaking 'Star Wars' movie opens in China View
2016,1,8,Record-breaking 'Star Wars' movie opens in China View
2016,1,8,Celebs start their awards-season schmoozing at AFI Awards View
2016,1,8,College Football Playoff plans to stick with New Year's Eve
2016,1,8,"Golden Globes to offer a galaxy of stars on Sunday, if not the Force"
2016,1,8,Toys R Us holds its own against online holiday competition
2016,1,8,"Top travel destinations of 2016: Rio, Cuba, 'Star Wars' at Disneyland and more"
2016,1,8,List of nominees for 2016 British Academy Film Awards
2016,1,7,"'Bridge of Spies,' 'Carol' lead race for British film awards"
2016,1,7,"Movie bargains: ‘Learning to Drive,’ ‘Joy,’ ‘Labyrinth’"
2016,1,7,More Seahawks Superlatives from Jimmy Fallon (and some on the Vikings) Watch
2016,1,7,"Golden Globes to offer a galaxy of stars, if not the Force View"
2016,1,7,'Star Wars' Monopoly to include Rey after girl complains
2016,1,6,'Star Wars' becomes highest grossing domestic movie ever
2016,1,6,"Pentagon set to announce awards for combat, drone service"
2016,1,5,Original Boba Fett voice actor Jason Wingreen dies at 95
2016,1,5,The top 10 audiobooks on Audible.com
2016,1,5,"'Spotlight,' 'Straight Outta Compton' among PGA nominees"
2016,1,5,"Seattle’s art-world status is rising, brick by tiny brick"
2016,1,4,Box Office Top 20: 'Star Wars' flies toward 'Avatar' record
2016,1,4,Disneyland closes attractions to make way for new ‘Star Wars’ area
2016,1,3,"'Star Wars' box office surpasses 'Titanic,' 'Jurassic World'"
2016,1,3,‘The Force Awakens’ fashion is easy to wear
2016,1,1,"Security concerns, temperatures don't take fun out of parade View"
2015,12,31,10 Things to Know for Friday
2015,12,31,Our critics’ picks for 2015’s dubious achievements at the movies
2015,12,31,Chimerix and NuStar are big market movers
2015,12,31,George Lucas apologizes for calling Disney 'white slavers'
